{
  "$schema": "./model-manifest.schema.json",
  "id": "voxtral-4b-tts-2603-mlx-bf16",
  "task": "tts",
  "source": {
    "repository": "mistralai/Voxtral-4B-TTS-2603",
    "observed_revision": "b81be46c3777f88621676791b512bb01dc1cb970",
    "license": "CC-BY-NC-4.0",
    "supported_languages": [
      "English",
      "French",
      "Spanish",
      "German",
      "Italian",
      "Portuguese",
      "Dutch",
      "Arabic",
      "Hindi"
    ],
    "provenance_limit": "The conversion identifies the official model as its base but does not identify the exact conversion-input commit. The observed source revision pins current capability and license evidence without asserting lineage to the converted bytes."
  },
  "artifact": {
    "repository": "mlx-community/Voxtral-4B-TTS-2603-mlx-bf16",
    "revision": "dd85c02adbae551f5bb29ded35ee60ccdfb90927",
    "license": "CC-BY-NC-4.0",
    "format": "MLX BF16 sharded safetensors",
    "conversion_tool": "mlx-audio",
    "conversion_tool_version": "0.4.1",
    "weight_bytes": 8022701410,
    "snapshot_bytes": 8037606951,
    "artifacts": [
      {
        "path": ".gitattributes",
        "bytes": 1567,
        "sha256": "a1533fad1fb49e1230aff61a60028ea63bc924b4cc4501447351b50b9c840683",
        "digest_source": "downloaded-at-pinned-revision"
      },
      {
        "path": "README.md",
        "bytes": 1621,
        "sha256": "93fb224d2bd570ee6fc4cf5cdf0faeb357f2d8f03480c68dbb7a128e024b5587",
        "digest_source": "downloaded-at-pinned-revision"
      },
      {
        "path": "config.json",
        "bytes": 4140,
        "sha256": "190aeec40bb3fed3b9dc84a4b056a865898298f7e9ec663baa1bdb9dc0759624",
        "digest_source": "downloaded-at-pinned-revision"
      },
      {
        "path": "model-00001-of-00002.safetensors",
        "bytes": 5347995246,
        "sha256": "5c9a69e0d545d2e8ede13c3ae86a4da5dc72be6c1dd4168754ea1b8e7f6af621",
        "digest_source": "hugging-face-lfs-metadata"
      },
      {
        "path": "model-00002-of-00002.safetensors",
        "bytes": 2656763924,
        "sha256": "4f1be4677be52013780d96eb489221c54fbaac71701d631c1803c43f42fd707e",
        "digest_source": "hugging-face-lfs-metadata"
      },
      {
        "path": "params.json",
        "bytes": 3482,
        "sha256": "f6408ee76dea8da16ce40ac66729d59406019ea71cdb9d656709a38d2e58691e",
        "digest_source": "downloaded-at-pinned-revision"
      },
      {
        "path": "tekken.json",
        "bytes": 14894731,
        "sha256": "587989c9f56676b35e7d16d6fc61461301e402d908392a8ce16f0349f61b56d7",
        "digest_source": "hugging-face-lfs-metadata"
      },
      {
        "path": "voice_embedding/ar_male.safetensors",
        "bytes": 411736,
        "sha256": "f4c480657b730c169614c66dcb26684bc234ee2829cb2a9e490c300f60b1782a",
        "digest_source": "hugging-face-lfs-metadata"
      },
      {
        "path": "voice_embedding/casual_female.safetensors",
        "bytes": 1314904,
        "sha256": "9a2027d9265fd7ef4a55294b10ae8b2095dcad7547d50762a5012a3955ca0860",
        "digest_source": "hugging-face-lfs-metadata"
      },
      {
        "path": "voice_embedding/casual_male.safetensors",
        "bytes": 903256,
        "sha256": "2056ade898f6f1b04c1af764f54d705038ac046f0b4967457a36989b69730fa8",
        "digest_source": "hugging-face-lfs-metadata"
      },
      {
        "path": "voice_embedding/cheerful_female.safetensors",
        "bytes": 811096,
        "sha256": "35441e3030ba0076356ef1ad54fbfd5adfbde9e34bbf8a1a6535d6efabe63af1",
        "digest_source": "hugging-face-lfs-metadata"
      },
      {
        "path": "voice_embedding/de_female.safetensors",
        "bytes": 903256,
        "sha256": "a89197fe5e77a2dd3cfc4ac0ed1cb5248e4e1ac26fdb13500e9782e43a90a69e",
        "digest_source": "hugging-face-lfs-metadata"
      },
      {
        "path": "voice_embedding/de_male.safetensors",
        "bytes": 1001560,
        "sha256": "cabfeeb98db0b713a80f234e11d90c3105fe83e64de75876509c3cda43946656",
        "digest_source": "hugging-face-lfs-metadata"
      },
      {
        "path": "voice_embedding/es_female.safetensors",
        "bytes": 847960,
        "sha256": "52bca0b4e770afaccc3f2899d7396009422a0b3fdb5a6a96c523bcdc2f35c165",
        "digest_source": "hugging-face-lfs-metadata"
      },
      {
        "path": "voice_embedding/es_male.safetensors",
        "bytes": 1278040,
        "sha256": "b63fd5dff4dbc5070d470a364b8691f63fd6c10412a2692101bf6a90549c36e1",
        "digest_source": "hugging-face-lfs-metadata"
      },
      {
        "path": "voice_embedding/fr_female.safetensors",
        "bytes": 596056,
        "sha256": "e8be0f673696dc1bf668fa6cc9999ab09ab43b29a6d6e85c5ac3f9f8ed43c449",
        "digest_source": "hugging-face-lfs-metadata"
      },
      {
        "path": "voice_embedding/fr_male.safetensors",
        "bytes": 596056,
        "sha256": "d34fde0b57acaea4c3f78e841c93dd290f104a167dd0bea9e0673d9cdfedadd5",
        "digest_source": "hugging-face-lfs-metadata"
      },
      {
        "path": "voice_embedding/hi_female.safetensors",
        "bytes": 528472,
        "sha256": "01e987092046cf5dc1041f00d10b0763f9ab4080c3bf124d97a01ccb04428e26",
        "digest_source": "hugging-face-lfs-metadata"
      },
      {
        "path": "voice_embedding/hi_male.safetensors",
        "bytes": 577624,
        "sha256": "342d40fcda1e2a6ded081f0d2d8eefadcc7b8102a20da6e7e803ef4b4a21785c",
        "digest_source": "hugging-face-lfs-metadata"
      },
      {
        "path": "voice_embedding/it_female.safetensors",
        "bytes": 1056856,
        "sha256": "378b9bab596a68780ca07f4bf2032a9c70847825772aed9ee148ba8173b477d3",
        "digest_source": "hugging-face-lfs-metadata"
      },
      {
        "path": "voice_embedding/it_male.safetensors",
        "bytes": 1032280,
        "sha256": "05e313648254a57e4ca7e503b416590a4c832a106f7201efd4dea02ecce79035",
        "digest_source": "hugging-face-lfs-metadata"
      },
      {
        "path": "voice_embedding/neutral_female.safetensors",
        "bytes": 1339480,
        "sha256": "e229d5646ab8c2cad1b4e24cd63b88192f34da61de8f0595291799232460752f",
        "digest_source": "hugging-face-lfs-metadata"
      },
      {
        "path": "voice_embedding/neutral_male.safetensors",
        "bytes": 1038424,
        "sha256": "b114132e7301b2d2308ff7b0c1843574bab9ffeac5fc2dd48ca27db70a24ea0c",
        "digest_source": "hugging-face-lfs-metadata"
      },
      {
        "path": "voice_embedding/nl_female.safetensors",
        "bytes": 897112,
        "sha256": "0124a62762a89b9a4ef0ff0c016db045ccfe30ed9fa3d886db0e78e444673ea3",
        "digest_source": "hugging-face-lfs-metadata"
      },
      {
        "path": "voice_embedding/nl_male.safetensors",
        "bytes": 847960,
        "sha256": "6f931e4c34cf496cce4ed7ce5d8af286140c4969860f9410b12237ff28de2d33",
        "digest_source": "hugging-face-lfs-metadata"
      },
      {
        "path": "voice_embedding/pt_female.safetensors",
        "bytes": 1075288,
        "sha256": "ce23b97302fe6ca58507b1ae2c2fe1d0a472268b1faf597901cbf75e326a08f9",
        "digest_source": "hugging-face-lfs-metadata"
      },
      {
        "path": "voice_embedding/pt_male.safetensors",
        "bytes": 884824,
        "sha256": "4ccd63a39d35f483c89485112d35a8a2121cbb0e6d5d124e403e40d03e0c0e82",
        "digest_source": "hugging-face-lfs-metadata"
      }
    ]
  },
  "reference_runtime": {
    "repository": "Blaizzy/mlx-audio",
    "revision": "64e8416c303fb3b3463dab8eb4ebd78c55a87c1a",
    "version": "0.4.5",
    "license": "MIT",
    "boundary": "Pinned Python reference runner over official Apple MLX"
  },
  "calibration": {
    "role": "required-generator",
    "status": "pinned-pending-execution",
    "voice_mode": "preset",
    "sample_rate_hz": 24000,
    "profiles": [
      {
        "id": "voxtral-de-female",
        "locale": "de-DE",
        "language": "German",
        "passage_id": "synthetic-de-origin",
        "voice": "de_female",
        "instruction": null,
        "seed": 0
      },
      {
        "id": "voxtral-de-male",
        "locale": "de-DE",
        "language": "German",
        "passage_id": "synthetic-de-origin",
        "voice": "de_male",
        "instruction": null,
        "seed": 0
      },
      {
        "id": "voxtral-en-casual-female",
        "locale": "en-US",
        "language": "English",
        "passage_id": "synthetic-en-reasoning",
        "voice": "casual_female",
        "instruction": null,
        "seed": 0
      },
      {
        "id": "voxtral-en-casual-male",
        "locale": "en-US",
        "language": "English",
        "passage_id": "synthetic-en-reasoning",
        "voice": "casual_male",
        "instruction": null,
        "seed": 0
      }
    ],
    "generation": {
      "temperature": 0.8,
      "top_p": 0.95,
      "top_k": 50,
      "max_tokens": 1200,
      "stream": false
    }
  },
  "architecture": {
    "model_type": "voxtral_tts",
    "sample_rate_hz": 24000,
    "frame_rate_hz": 12.5,
    "language_model_layers": 26,
    "language_model_hidden_size": 3072,
    "acoustic_transformer_layers": 3,
    "semantic_codebook_size": 8192,
    "acoustic_codebook_count": 36,
    "voice_count": 20
  },
  "constraints": [
    "The model weights and supplied voice embeddings are CC-BY-NC-4.0 and remain local evaluation dependencies.",
    "Production use requires the hosted Mistral API or a separate commercial license even if BF16 wins the quality calibration.",
    "The model card reports approximately 6.5x real-time for BF16, so operational cost is an explicit promotion gate."
  ]
}
